wandb: WARNING `start_method` is deprecated and will be removed in a future version of wandb. This setting is currently non-functional and safely ignored.
wandb: Currently logged in as: ssmurali (ssmurali-cmu) to https://api.wandb.ai. Use `wandb login --relogin` to force relogin
+++ hostname
+++ whoami
++ MACHINE_SPECIFIC_RAY_DIR=/tmp/ray_babel-t5-24_ssmurali_1905602
++ mkdir -p /tmp/ray_babel-t5-24_ssmurali_1905602
++ export RAY_TMPDIR=/tmp/ray_babel-t5-24_ssmurali_1905602
++ RAY_TMPDIR=/tmp/ray_babel-t5-24_ssmurali_1905602
+++ nvidia-smi --query-gpu=name --format=csv,noheader
+++ head -n 1
++ GPU_MODEL='NVIDIA L40S'
++ [[ NVIDIA L40S == *\A\6\0\0\0* ]]
++ [[ NVIDIA L40S == *\L\4\0\S* ]]
++ echo 'Detected NVIDIA L40S, disabling NCCL P2P'
++ export NCCL_P2P_DISABLE=1
++ NCCL_P2P_DISABLE=1
++ export VLLM_ATTENTION_BACKEND=XFORMERS
++ VLLM_ATTENTION_BACKEND=XFORMERS
++ export HYDRA_FULL_ERROR=1
++ HYDRA_FULL_ERROR=1
++ export RAY_DEBUG=0
++ RAY_DEBUG=0
++ export WANDB_API_KEY=1e255990efc627595f0c805e0546cc7f0ff08b17
++ WANDB_API_KEY=1e255990efc627595f0c805e0546cc7f0ff08b17
++ export HF_TOKEN=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
++ HF_TOKEN=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
++ export HUGGING_FACE_HUB_TOKEN=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
++ HUGGING_FACE_HUB_TOKEN=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
++ export OPENAI_API_KEY=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
++ OPENAI_API_KEY=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
++ export OPENAI_API_KEY=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
++ OPENAI_API_KEY=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
++ MODEL_DIR=/data/group_data/cx_group/verl_agent_shared
++ train_data_size=32
++ val_data_size=16
++ group_size=8
++ python3 -m verl.trainer.main_ppo algorithm.adv_estimator=grpo algorithm.use_kl_in_reward=False algorithm.compute_mean_std_cross_all_data=False data.train_files=dummy_data/text/train.parquet data.val_files=dummy_data/text/val.parquet data.train_batch_size=32 data.val_batch_size=16 data.max_prompt_length=20000 data.max_response_length=1024 data.filter_overlong_prompts=True data.truncation=error data.return_raw_chat=True actor_rollout_ref.rollout.temperature=1.0 actor_rollout_ref.model.path=/data/group_data/cx_group/behavior_priming/checkpoint/qwen3_1.7b/web_qwen_sft_behavior/checkpoint-924 actor_rollout_ref.model.use_remove_padding=True actor_rollout_ref.actor.use_kl_loss=True actor_rollout_ref.actor.kl_loss_coef=0.001 actor_rollout_ref.actor.kl_loss_type=low_var_kl actor_rollout_ref.actor.optim.lr=1e-6 actor_rollout_ref.actor.use_dynamic_bsz=True actor_rollout_ref.actor.ppo_max_token_len_per_gpu=22000 actor_rollout_ref.actor.ppo_mini_batch_size=32 actor_rollout_ref.actor.fsdp_config.param_offload=False actor_rollout_ref.actor.fsdp_config.optimizer_offload=False actor_rollout_ref.actor.ulysses_sequence_parallel_size=1 actor_rollout_ref.model.enable_activation_offload=False actor_rollout_ref.rollout.log_prob_micro_batch_size_per_gpu=64 actor_rollout_ref.rollout.tensor_model_parallel_size=1 actor_rollout_ref.rollout.name=vllm actor_rollout_ref.rollout.gpu_memory_utilization=0.5 actor_rollout_ref.rollout.enable_chunked_prefill=False actor_rollout_ref.rollout.enforce_eager=True actor_rollout_ref.rollout.free_cache_engine=True actor_rollout_ref.rollout.val_kwargs.temperature=0.4 actor_rollout_ref.rollout.val_kwargs.do_sample=True actor_rollout_ref.rollout.max_num_batched_tokens=22000 actor_rollout_ref.rollout.max_model_len=22000 actor_rollout_ref.rollout.disable_log_stats=False actor_rollout_ref.ref.log_prob_micro_batch_size_per_gpu=64 actor_rollout_ref.ref.fsdp_config.param_offload=True actor_rollout_ref.ref.max_model_len=22000 actor_rollout_ref.actor.use_invalid_action_penalty=True env.rule_reward_coef=0 env.env_name=deepresearch env.dataset=afm env.seed=0 env.rollout.n=8 env.rollout.k=1 env.max_steps=8 env.use_explicit_thinking=False env.use_critique=False env.replace_input=False env.use_rule_reward=False env.rule_number=5 env.use_dense_reward=False env.belief_shaped_grpo.enable=True env.belief_shaped_grpo.alpha=1.0 env.belief_shaped_grpo.max_candidates=1 trainer.critic_warmup=0 'trainer.logger=[console,wandb]' trainer.project_name=DeepResearch_RL trainer.experiment_name=deepresearch_1.7b_belief_shaped_grpo_fast_reward_resume trainer.n_gpus_per_node=4 trainer.nnodes=1 trainer.save_freq=5 trainer.test_freq=25 trainer.total_epochs=1 trainer.total_training_steps=50 trainer.resume_mode=auto trainer.default_local_dir=/data/group_data/cx_group/verl_agent_shared/checkpoint/deepresearch_1.7b_belief_shaped_grpo_fast_reward trainer.val_before_train=False trainer.log_val_generations=1
2025-12-22 23:21:14,747	ERROR services.py:1357 -- Failed to start the dashboard 
2025-12-22 23:21:14,747	ERROR services.py:1382 -- Error should be written to 'dashboard.log' or 'dashboard.err'. We are printing the last 20 lines for you. See 'https://docs.ray.io/en/master/ray-observability/user-guides/configure-logging.html#logging-directory-structure' to find where the log file is.
2025-12-22 23:21:14,748	ERROR services.py:1426 -- 
The last 20 lines of /tmp/ray_babel-t5-24_ssmurali_1905602/ray/session_2025-12-22_23-20-54_242007_1905610/logs/dashboard.log (it contains the error message from the dashboard): 
    buf = self._recv(4)
          ^^^^^^^^^^^^^
  File "/home/ssmurali/miniconda3/envs/verl-agent/lib/python3.12/multiprocessing/connection.py", line 382, in _recv
    raise EOFError
EOFError

During handling of the above exception, another exception occurred:

Traceback (most recent call last):
  File "/home/ssmurali/miniconda3/envs/verl-agent/lib/python3.12/site-packages/ray/dashboard/dashboard.py", line 297, in <module>
    loop.run_until_complete(dashboard.run())
  File "/home/ssmurali/miniconda3/envs/verl-agent/lib/python3.12/asyncio/base_events.py", line 664, in run_until_complete
    return future.result()
           ^^^^^^^^^^^^^^^
  File "/home/ssmurali/miniconda3/envs/verl-agent/lib/python3.12/site-packages/ray/dashboard/dashboard.py", line 98, in run
    await self.dashboard_head.run()
  File "/home/ssmurali/miniconda3/envs/verl-agent/lib/python3.12/site-packages/ray/dashboard/head.py", line 405, in run
    handle.wait_for_module_ready()
  File "/home/ssmurali/miniconda3/envs/verl-agent/lib/python3.12/site-packages/ray/dashboard/subprocesses/handle.py", line 146, in wait_for_module_ready
    raise RuntimeError(
RuntimeError: Module MetricsHead failed to start. Received EOF from pipe.
2025-12-22 23:21:14,960	INFO worker.py:1951 -- Started a local Ray instance.
[2025-12-22 23:21:14,963 I 1905610 1905610] logging.cc:303: Set ray log level from environment variable RAY_BACKEND_LOG_LEVEL to 1
[33m(raylet)[0m [2025-12-22 23:21:15,748 I 1906873 1906873] logging.cc:303: Set ray log level from environment variable RAY_BACKEND_LOG_LEVEL to 1
[36m(TaskRunner pid=1910234)[0m Gym has been unmaintained since 2022 and does not support NumPy 2.0 amongst other critical functionality.
[36m(TaskRunner pid=1910234)[0m Please upgrade to Gymnasium, the maintained drop-in replacement of Gym, or contact the authors of your software and request that they upgrade.
[36m(TaskRunner pid=1910234)[0m Users of this version of Gym should be able to simply replace 'import gym' with 'import gymnasium as gym' in the vast majority of cases.
[36m(TaskRunner pid=1910234)[0m See the migration guide at https://gymnasium.farama.org/introduction/migration_guide/ for additional information.
[33m(raylet)[0m [2025-12-22 23:21:16,325 I 1910234 1910234] logging.cc:303: Set ray log level from environment variable RAY_BACKEND_LOG_LEVEL to 1
[36m(TaskRunner pid=1910234)[0m building DeepResearchMultiProcessEnv with config: {'verbose': False, 'log_dir': '/home/ssmurali/verl-agent/agent_system/environments/env_package/deepresearch/../../../../deepresearch_logs_Belief/afm_train/20251222_232123', 'answer_dir': '/home/ssmurali/verl-agent/agent_system/environments/env_package/deepresearch/../../../../deepresearch_outputs_Belief/afm_train/20251222_232123', 'max_turns': 8, 'num_docs': 1, 'num_docs_to_read': 1, 'search_reminder_turn': 3, 'final_report_reminder_turn': 5, 'max_context_length': 8000, 'mode': 'qa', 'search_engine': 'serper', 'use_explicit_thinking': False, 'use_critique': False}
[36m(TaskRunner pid=1910234)[0m Init DeepResearchMultiProcessEnv, env_num: 32, group_n: 8, num_processes: 256
[36m(TaskRunner pid=1910234)[0m building DeepResearchMultiProcessEnv with config: {'verbose': False, 'log_dir': '/home/ssmurali/verl-agent/agent_system/environments/env_package/deepresearch/../../../../deepresearch_logs_Belief/afm_val/20251222_232123', 'answer_dir': '/home/ssmurali/verl-agent/agent_system/environments/env_package/deepresearch/../../../../deepresearch_outputs_Belief/afm_val/20251222_232123', 'max_turns': 8, 'num_docs': 1, 'num_docs_to_read': 1, 'search_reminder_turn': 3, 'final_report_reminder_turn': 5, 'max_context_length': 8000, 'mode': 'qa', 'search_engine': 'serper', 'use_explicit_thinking': False, 'use_critique': False}
[36m(TaskRunner pid=1910234)[0m Init DeepResearchMultiProcessEnv, env_num: 16, group_n: 1, num_processes: 16
[33m(raylet)[0m [2025-12-22 23:21:24,590 I 1910410 1910410] logging.cc:303: Set ray log level from environment variable RAY_BACKEND_LOG_LEVEL to 1
[33m(raylet)[0m [2025-12-22 23:21:29,644 I 1918217 1918217] logging.cc:303: Set ray log level from environment variable RAY_BACKEND_LOG_LEVEL to 1[32m [repeated 179x across cluster] (Ray deduplicates logs by default. Set RAY_DEDUP_LOGS=0 to disable log deduplication, or see https://docs.ray.io/en/master/ray-observability/user-guides/configure-logging.html#log-deduplication for more options.)[0m
[36m(pid=1910412)[0m Gym has been unmaintained since 2022 and does not support NumPy 2.0 amongst other critical functionality.
[36m(pid=1910412)[0m Please upgrade to Gymnasium, the maintained drop-in replacement of Gym, or contact the authors of your software and request that they upgrade.
[36m(pid=1910412)[0m Users of this version of Gym should be able to simply replace 'import gym' with 'import gymnasium as gym' in the vast majority of cases.
[36m(pid=1910412)[0m See the migration guide at https://gymnasium.farama.org/introduction/migration_guide/ for additional information.
[33m(raylet)[0m [2025-12-22 23:21:34,670 I 1923271 1923271] logging.cc:303: Set ray log level from environment variable RAY_BACKEND_LOG_LEVEL to 1[32m [repeated 82x across cluster][0m
[36m(pid=1913936)[0m Gym has been unmaintained since 2022 and does not support NumPy 2.0 amongst other critical functionality.[32m [repeated 90x across cluster][0m
[36m(pid=1913936)[0m Please upgrade to Gymnasium, the maintained drop-in replacement of Gym, or contact the authors of your software and request that they upgrade.[32m [repeated 90x across cluster][0m
[36m(pid=1913936)[0m Users of this version of Gym should be able to simply replace 'import gym' with 'import gymnasium as gym' in the vast majority of cases.[32m [repeated 90x across cluster][0m
[36m(pid=1913936)[0m See the migration guide at https://gymnasium.farama.org/introduction/migration_guide/ for additional information.[32m [repeated 90x across cluster][0m
[36m(TaskRunner pid=1910234)[0m Filtering prompts longer than 20000 tokens:   0%|          | 0/1600 [00:00<?, ? examples/s]
[36m(TaskRunner pid=1910234)[0m Filtering prompts longer than 20000 tokens:  62%|██████▎   | 1000/1600 [00:00<00:00, 2946.89 examples/s]
[36m(TaskRunner pid=1910234)[0m Filtering prompts longer than 20000 tokens: 100%|██████████| 1600/1600 [00:00<00:00, 3637.69 examples/s]Filtering prompts longer than 20000 tokens: 100%|██████████| 1600/1600 [00:00<00:00, 3447.90 examples/s]
[36m(TaskRunner pid=1910234)[0m Filtering prompts longer than 20000 tokens:   0%|          | 0/512 [00:00<?, ? examples/s]Filtering prompts longer than 20000 tokens: 100%|██████████| 512/512 [00:00<00:00, 5071.94 examples/s]
[36m(TaskRunner pid=1910234)[0m Filtering prompts longer than 20000 tokens: 100%|██████████| 512/512 [00:00<00:00, 4768.15 examples/s]
[36m(TaskRunner pid=1910234)[0m DeprecationWarning: `ray.state.available_resources_per_node` is a private attribute and access will be removed in a future Ray version.
[33m(raylet)[0m [2025-12-22 23:21:39,654 I 1927732 1927732] logging.cc:303: Set ray log level from environment variable RAY_BACKEND_LOG_LEVEL to 1[32m [repeated 11x across cluster][0m
[36m(TaskRunner pid=1910234)[0m WARNING:2025-12-22 23:21:40,236:Waiting for register center actor lD62lp_register_center to be ready. Elapsed time: 0 seconds out of 300 seconds.
[36m(pid=1923273)[0m Gym has been unmaintained since 2022 and does not support NumPy 2.0 amongst other critical functionality.[32m [repeated 154x across cluster][0m
[36m(pid=1923273)[0m Please upgrade to Gymnasium, the maintained drop-in replacement of Gym, or contact the authors of your software and request that they upgrade.[32m [repeated 154x across cluster][0m
[36m(pid=1923273)[0m Users of this version of Gym should be able to simply replace 'import gym' with 'import gymnasium as gym' in the vast majority of cases.[32m [repeated 154x across cluster][0m
[36m(pid=1923273)[0m See the migration guide at https://gymnasium.farama.org/introduction/migration_guide/ for additional information.[32m [repeated 154x across cluster][0m
[33m(raylet)[0m [2025-12-22 23:22:00,003 I 1929515 1929515] logging.cc:303: Set ray log level from environment variable RAY_BACKEND_LOG_LEVEL to 1[32m [repeated 2x across cluster][0m
[36m(pid=1923051)[0m Gym has been unmaintained since 2022 and does not support NumPy 2.0 amongst other critical functionality.[32m [repeated 27x across cluster][0m
[36m(pid=1923051)[0m Please upgrade to Gymnasium, the maintained drop-in replacement of Gym, or contact the authors of your software and request that they upgrade.[32m [repeated 27x across cluster][0m
[36m(pid=1923051)[0m Users of this version of Gym should be able to simply replace 'import gym' with 'import gymnasium as gym' in the vast majority of cases.[32m [repeated 27x across cluster][0m
[36m(pid=1923051)[0m See the migration guide at https://gymnasium.farama.org/introduction/migration_guide/ for additional information.[32m [repeated 27x across cluster][0m
[36m(WorkerDict pid=1930242)[0m `torch_dtype` is deprecated! Use `dtype` instead!
[33m(raylet)[0m [2025-12-22 23:22:00,913 I 1930243 1930243] logging.cc:303: Set ray log level from environment variable RAY_BACKEND_LOG_LEVEL to 1[32m [repeated 3x across cluster][0m
[36m(WorkerDict pid=1930241)[0m Flash Attention 2 only supports torch.float16 and torch.bfloat16 dtypes, but the current dype in Qwen3ForCausalLM is torch.float32. You should run training or inference using Automatic Mixed-Precision via the `with torch.autocast(device_type='torch_device'):` decorator, or load the model with the `dtype` argument. Example: `model = AutoModel.from_pretrained("openai/whisper-tiny", attn_implementation="flash_attention_2", dtype=torch.float16)`
[36m(WorkerDict pid=1930241)[0m Flash Attention 2 only supports torch.float16 and torch.bfloat16 dtypes, but the current dype in Qwen3Model is torch.float32. You should run training or inference using Automatic Mixed-Precision via the `with torch.autocast(device_type='torch_device'):` decorator, or load the model with the `dtype` argument. Example: `model = AutoModel.from_pretrained("openai/whisper-tiny", attn_implementation="flash_attention_2", dtype=torch.float16)`
[36m(WorkerDict pid=1930243)[0m `torch_dtype` is deprecated! Use `dtype` instead![32m [repeated 3x across cluster][0m
[36m(WorkerDict pid=1930242)[0m /home/ssmurali/miniconda3/envs/verl-agent/lib/python3.12/site-packages/torch/distributed/fsdp/fully_sharded_data_parallel.py:690: FutureWarning: FSDP.state_dict_type() and FSDP.set_state_dict_type() are being deprecated. Please use APIs, get_state_dict() and set_state_dict(), which can support different parallelisms, FSDP1, FSDP2, DDP. API doc: https://pytorch.org/docs/stable/distributed.checkpoint.html#torch.distributed.checkpoint.state_dict.get_state_dict .Tutorial: https://pytorch.org/tutorials/recipes/distributed_checkpoint_recipe.html .
[36m(WorkerDict pid=1930242)[0m   warnings.warn(
[36m(WorkerDict pid=1930243)[0m Flash Attention 2 only supports torch.float16 and torch.bfloat16 dtypes, but the current dype in Qwen3Model is torch.float32. You should run training or inference using Automatic Mixed-Precision via the `with torch.autocast(device_type='torch_device'):` decorator, or load the model with the `dtype` argument. Example: `model = AutoModel.from_pretrained("openai/whisper-tiny", attn_implementation="flash_attention_2", dtype=torch.float16)`[32m [repeated 6x across cluster][0m
[36m(WorkerDict pid=1930243)[0m `torch_dtype` is deprecated! Use `dtype` instead![32m [repeated 4x across cluster][0m
[36m(TaskRunner pid=1910234)[0m wandb: WARNING `start_method` is deprecated and will be removed in a future version of wandb. This setting is currently non-functional and safely ignored.
[36m(TaskRunner pid=1910234)[0m wandb: Currently logged in as: ssmurali (ssmurali-cmu) to https://api.wandb.ai. Use `wandb login --relogin` to force relogin
[36m(TaskRunner pid=1910234)[0m wandb: Tracking run with wandb version 0.21.3
[36m(TaskRunner pid=1910234)[0m wandb: Run data is saved locally in /home/ssmurali/verl-agent/wandb/run-20251222_232250-yhzt8s7e
[36m(TaskRunner pid=1910234)[0m wandb: Run `wandb offline` to turn off syncing.
[36m(TaskRunner pid=1910234)[0m wandb: Syncing run deepresearch_1.7b_belief_shaped_grpo_fast_reward_resume
[36m(TaskRunner pid=1910234)[0m wandb: ⭐️ View project at https://wandb.ai/ssmurali-cmu/DeepResearch_RL
[36m(TaskRunner pid=1910234)[0m wandb: 🚀 View run at https://wandb.ai/ssmurali-cmu/DeepResearch_RL/runs/yhzt8s7e
[36m(TaskRunner pid=1910234)[0m Training Progress:  60%|██████    | 30/50 [00:00<?, ?it/s]
[36m(WorkerDict pid=1930241)[0m /home/ssmurali/miniconda3/envs/verl-agent/lib/python3.12/site-packages/torch/distributed/fsdp/fully_sharded_data_parallel.py:690: FutureWarning: FSDP.state_dict_type() and FSDP.set_state_dict_type() are being deprecated. Please use APIs, get_state_dict() and set_state_dict(), which can support different parallelisms, FSDP1, FSDP2, DDP. API doc: https://pytorch.org/docs/stable/distributed.checkpoint.html#torch.distributed.checkpoint.state_dict.get_state_dict .Tutorial: https://pytorch.org/tutorials/recipes/distributed_checkpoint_recipe.html .[32m [repeated 3x across cluster][0m
[36m(WorkerDict pid=1930241)[0m   warnings.warn([32m [repeated 3x across cluster][0m
[36m(TaskRunner pid=1910234)[0m Reset 256 workers (env_num=32, group_n=8, dataset_name=afm_train)
[36m(TaskRunner pid=1910234)[0m Step 256 workers (env_num=32, group_n=8, dataset_name=afm_train)
[36m(TaskRunner pid=1910234)[0m Step 256 workers (env_num=32, group_n=8, dataset_name=afm_train)
[36m(TaskRunner pid=1910234)[0m Step 256 workers (env_num=32, group_n=8, dataset_name=afm_train)
[36m(TaskRunner pid=1910234)[0m Step 256 workers (env_num=32, group_n=8, dataset_name=afm_train)
[36m(TaskRunner pid=1910234)[0m Step 256 workers (env_num=32, group_n=8, dataset_name=afm_train)
[36m(TaskRunner pid=1910234)[0m Step 256 workers (env_num=32, group_n=8, dataset_name=afm_train)
[36m(TaskRunner pid=1910234)[0m Step 256 workers (env_num=32, group_n=8, dataset_name=afm_train)
[36m(TaskRunner pid=1910234)[0m Step 256 workers (env_num=32, group_n=8, dataset_name=afm_train)
[36m(TaskRunner pid=1910234)[0m /home/ssmurali/miniconda3/envs/verl-agent/lib/python3.12/site-packages/numpy/_core/fromnumeric.py:3860: RuntimeWarning: Mean of empty slice.
[36m(TaskRunner pid=1910234)[0m   return _methods._mean(a, axis=axis, dtype=dtype,
[36m(TaskRunner pid=1910234)[0m /home/ssmurali/miniconda3/envs/verl-agent/lib/python3.12/site-packages/numpy/_core/_methods.py:145: RuntimeWarning: invalid value encountered in scalar divide
[36m(TaskRunner pid=1910234)[0m   ret = ret.dtype.type(ret / rcount)
[36m(TaskRunner pid=1910234)[0m Training Progress:  62%|██████▁   | 31/50 [49:53<15:47:55, 2993.45s/it]Reset 256 workers (env_num=32, group_n=8, dataset_name=afm_train)
[36m(TaskRunner pid=1910234)[0m Step 256 workers (env_num=32, group_n=8, dataset_name=afm_train)
[36m(TaskRunner pid=1910234)[0m Step 256 workers (env_num=32, group_n=8, dataset_name=afm_train)
[36m(TaskRunner pid=1910234)[0m Step 256 workers (env_num=32, group_n=8, dataset_name=afm_train)
[36m(TaskRunner pid=1910234)[0m Step 256 workers (env_num=32, group_n=8, dataset_name=afm_train)
[36m(TaskRunner pid=1910234)[0m Step 256 workers (env_num=32, group_n=8, dataset_name=afm_train)
[36m(TaskRunner pid=1910234)[0m Step 256 workers (env_num=32, group_n=8, dataset_name=afm_train)
[36m(TaskRunner pid=1910234)[0m Step 256 workers (env_num=32, group_n=8, dataset_name=afm_train)
[36m(TaskRunner pid=1910234)[0m Step 256 workers (env_num=32, group_n=8, dataset_name=afm_train)
[36m(TaskRunner pid=1910234)[0m Training Progress:  64%|██████▁   | 32/50 [1:27:01<12:42:59, 2543.29s/it]Reset 256 workers (env_num=32, group_n=8, dataset_name=afm_train)
[36m(TaskRunner pid=1910234)[0m Step 256 workers (env_num=32, group_n=8, dataset_name=afm_train)
[36m(TaskRunner pid=1910234)[0m Step 256 workers (env_num=32, group_n=8, dataset_name=afm_train)
[36m(TaskRunner pid=1910234)[0m Step 256 workers (env_num=32, group_n=8, dataset_name=afm_train)
[36m(TaskRunner pid=1910234)[0m Step 256 workers (env_num=32, group_n=8, dataset_name=afm_train)
[36m(TaskRunner pid=1910234)[0m Step 256 workers (env_num=32, group_n=8, dataset_name=afm_train)
[36m(TaskRunner pid=1910234)[0m Step 256 workers (env_num=32, group_n=8, dataset_name=afm_train)
[36m(TaskRunner pid=1910234)[0m Step 256 workers (env_num=32, group_n=8, dataset_name=afm_train)
[36m(TaskRunner pid=1910234)[0m Step 256 workers (env_num=32, group_n=8, dataset_name=afm_train)
[36m(TaskRunner pid=1910234)[0m Training Progress:  66%|██████▌   | 33/50 [2:08:59<11:57:16, 2531.54s/it]Reset 256 workers (env_num=32, group_n=8, dataset_name=afm_train)
[36m(TaskRunner pid=1910234)[0m Step 256 workers (env_num=32, group_n=8, dataset_name=afm_train)
[36m(TaskRunner pid=1910234)[0m Step 256 workers (env_num=32, group_n=8, dataset_name=afm_train)
[36m(TaskRunner pid=1910234)[0m Step 256 workers (env_num=32, group_n=8, dataset_name=afm_train)
[36m(TaskRunner pid=1910234)[0m Step 256 workers (env_num=32, group_n=8, dataset_name=afm_train)
[36m(TaskRunner pid=1910234)[0m Step 256 workers (env_num=32, group_n=8, dataset_name=afm_train)
[36m(TaskRunner pid=1910234)[0m Step 256 workers (env_num=32, group_n=8, dataset_name=afm_train)
[36m(TaskRunner pid=1910234)[0m Step 256 workers (env_num=32, group_n=8, dataset_name=afm_train)
[36m(TaskRunner pid=1910234)[0m Step 256 workers (env_num=32, group_n=8, dataset_name=afm_train)
[36m(TaskRunner pid=1910234)[0m Training Progress:  68%|██████▊   | 34/50 [3:08:05<13:01:54, 2932.14s/it]
[36m(TaskRunner pid=1910234)[0m Reset 256 workers (env_num=32, group_n=8, dataset_name=afm_train)
[36m(TaskRunner pid=1910234)[0m Step 256 workers (env_num=32, group_n=8, dataset_name=afm_train)
[36m(TaskRunner pid=1910234)[0m Step 256 workers (env_num=32, group_n=8, dataset_name=afm_train)
[36m(TaskRunner pid=1910234)[0m Step 256 workers (env_num=32, group_n=8, dataset_name=afm_train)
[36m(TaskRunner pid=1910234)[0m Step 256 workers (env_num=32, group_n=8, dataset_name=afm_train)
[36m(TaskRunner pid=1910234)[0m Step 256 workers (env_num=32, group_n=8, dataset_name=afm_train)
[36m(TaskRunner pid=1910234)[0m Step 256 workers (env_num=32, group_n=8, dataset_name=afm_train)
[36m(TaskRunner pid=1910234)[0m Step 256 workers (env_num=32, group_n=8, dataset_name=afm_train)
[36m(TaskRunner pid=1910234)[0m Step 256 workers (env_num=32, group_n=8, dataset_name=afm_train)
[36m(TaskRunner pid=1910234)[0m Training Progress:  70%|███████   | 35/50 [3:50:57<11:40:33, 2802.20s/it]Reset 256 workers (env_num=32, group_n=8, dataset_name=afm_train)
[36m(TaskRunner pid=1910234)[0m Step 256 workers (env_num=32, group_n=8, dataset_name=afm_train)
[36m(TaskRunner pid=1910234)[0m Step 256 workers (env_num=32, group_n=8, dataset_name=afm_train)
[36m(TaskRunner pid=1910234)[0m Step 256 workers (env_num=32, group_n=8, dataset_name=afm_train)
[36m(TaskRunner pid=1910234)[0m Step 256 workers (env_num=32, group_n=8, dataset_name=afm_train)
[36m(TaskRunner pid=1910234)[0m Step 256 workers (env_num=32, group_n=8, dataset_name=afm_train)
[36m(TaskRunner pid=1910234)[0m Step 256 workers (env_num=32, group_n=8, dataset_name=afm_train)
[36m(TaskRunner pid=1910234)[0m Step 256 workers (env_num=32, group_n=8, dataset_name=afm_train)
[36m(TaskRunner pid=1910234)[0m Step 256 workers (env_num=32, group_n=8, dataset_name=afm_train)
[36m(TaskRunner pid=1910234)[0m Training Progress:  72%|███████▁  | 36/50 [4:39:59<11:04:58, 2849.89s/it]Reset 256 workers (env_num=32, group_n=8, dataset_name=afm_train)
[36m(TaskRunner pid=1910234)[0m Step 256 workers (env_num=32, group_n=8, dataset_name=afm_train)
[36m(TaskRunner pid=1910234)[0m Step 256 workers (env_num=32, group_n=8, dataset_name=afm_train)
[36m(TaskRunner pid=1910234)[0m Step 256 workers (env_num=32, group_n=8, dataset_name=afm_train)
[36m(TaskRunner pid=1910234)[0m Step 256 workers (env_num=32, group_n=8, dataset_name=afm_train)
[36m(TaskRunner pid=1910234)[0m Step 256 workers (env_num=32, group_n=8, dataset_name=afm_train)
[36m(TaskRunner pid=1910234)[0m Step 256 workers (env_num=32, group_n=8, dataset_name=afm_train)
[36m(TaskRunner pid=1910234)[0m Step 256 workers (env_num=32, group_n=8, dataset_name=afm_train)
[36m(TaskRunner pid=1910234)[0m Step 256 workers (env_num=32, group_n=8, dataset_name=afm_train)
[36m(TaskRunner pid=1910234)[0m Training Progress:  74%|███████▁  | 37/50 [5:37:55<11:01:47, 3054.40s/it]Reset 256 workers (env_num=32, group_n=8, dataset_name=afm_train)
[36m(TaskRunner pid=1910234)[0m Step 256 workers (env_num=32, group_n=8, dataset_name=afm_train)
[36m(TaskRunner pid=1910234)[0m Step 256 workers (env_num=32, group_n=8, dataset_name=afm_train)
[36m(TaskRunner pid=1910234)[0m Step 256 workers (env_num=32, group_n=8, dataset_name=afm_train)
[36m(TaskRunner pid=1910234)[0m Step 256 workers (env_num=32, group_n=8, dataset_name=afm_train)
[36m(TaskRunner pid=1910234)[0m Step 256 workers (env_num=32, group_n=8, dataset_name=afm_train)
[36m(TaskRunner pid=1910234)[0m Step 256 workers (env_num=32, group_n=8, dataset_name=afm_train)
[36m(TaskRunner pid=1910234)[0m Step 256 workers (env_num=32, group_n=8, dataset_name=afm_train)
[36m(TaskRunner pid=1910234)[0m Step 256 workers (env_num=32, group_n=8, dataset_name=afm_train)
[36m(TaskRunner pid=1910234)[0m Training Progress:  76%|███████▌  | 38/50 [6:28:29<10:09:37, 3048.13s/it]
[36m(TaskRunner pid=1910234)[0m Reset 256 workers (env_num=32, group_n=8, dataset_name=afm_train)
[36m(TaskRunner pid=1910234)[0m Step 256 workers (env_num=32, group_n=8, dataset_name=afm_train)
[36m(TaskRunner pid=1910234)[0m Step 256 workers (env_num=32, group_n=8, dataset_name=afm_train)
[36m(TaskRunner pid=1910234)[0m Step 256 workers (env_num=32, group_n=8, dataset_name=afm_train)
[36m(TaskRunner pid=1910234)[0m Step 256 workers (env_num=32, group_n=8, dataset_name=afm_train)
[36m(TaskRunner pid=1910234)[0m Step 256 workers (env_num=32, group_n=8, dataset_name=afm_train)
[36m(TaskRunner pid=1910234)[0m Step 256 workers (env_num=32, group_n=8, dataset_name=afm_train)
[36m(TaskRunner pid=1910234)[0m Step 256 workers (env_num=32, group_n=8, dataset_name=afm_train)
[36m(TaskRunner pid=1910234)[0m Step 256 workers (env_num=32, group_n=8, dataset_name=afm_train)
[36m(TaskRunner pid=1910234)[0m Training Progress:  78%|███████▊  | 39/50 [7:24:18<9:36:02, 3142.02s/it] Reset 256 workers (env_num=32, group_n=8, dataset_name=afm_train)
[36m(TaskRunner pid=1910234)[0m Step 256 workers (env_num=32, group_n=8, dataset_name=afm_train)
[36m(TaskRunner pid=1910234)[0m Step 256 workers (env_num=32, group_n=8, dataset_name=afm_train)
[36m(TaskRunner pid=1910234)[0m Step 256 workers (env_num=32, group_n=8, dataset_name=afm_train)
[36m(TaskRunner pid=1910234)[0m Step 256 workers (env_num=32, group_n=8, dataset_name=afm_train)
[36m(TaskRunner pid=1910234)[0m Step 256 workers (env_num=32, group_n=8, dataset_name=afm_train)
[36m(TaskRunner pid=1910234)[0m Step 256 workers (env_num=32, group_n=8, dataset_name=afm_train)
[36m(TaskRunner pid=1910234)[0m Step 256 workers (env_num=32, group_n=8, dataset_name=afm_train)
[36m(TaskRunner pid=1910234)[0m Step 256 workers (env_num=32, group_n=8, dataset_name=afm_train)
[36m(TaskRunner pid=1910234)[0m Training Progress:  80%|████████  | 40/50 [8:18:02<8:47:54, 3167.45s/it]
[36m(TaskRunner pid=1910234)[0m Reset 256 workers (env_num=32, group_n=8, dataset_name=afm_train)
[36m(TaskRunner pid=1910234)[0m Step 256 workers (env_num=32, group_n=8, dataset_name=afm_train)
[36m(TaskRunner pid=1910234)[0m Step 256 workers (env_num=32, group_n=8, dataset_name=afm_train)
[36m(TaskRunner pid=1910234)[0m Step 256 workers (env_num=32, group_n=8, dataset_name=afm_train)
[36m(TaskRunner pid=1910234)[0m Step 256 workers (env_num=32, group_n=8, dataset_name=afm_train)
[36m(TaskRunner pid=1910234)[0m Step 256 workers (env_num=32, group_n=8, dataset_name=afm_train)
[36m(TaskRunner pid=1910234)[0m Step 256 workers (env_num=32, group_n=8, dataset_name=afm_train)
[36m(TaskRunner pid=1910234)[0m Step 256 workers (env_num=32, group_n=8, dataset_name=afm_train)
[36m(TaskRunner pid=1910234)[0m Step 256 workers (env_num=32, group_n=8, dataset_name=afm_train)
[36m(TaskRunner pid=1910234)[0m Training Progress:  82%|████████▁ | 41/50 [9:11:16<7:56:20, 3175.58s/it]
[36m(TaskRunner pid=1910234)[0m Reset 256 workers (env_num=32, group_n=8, dataset_name=afm_train)
[36m(TaskRunner pid=1910234)[0m Step 256 workers (env_num=32, group_n=8, dataset_name=afm_train)
[36m(TaskRunner pid=1910234)[0m Step 256 workers (env_num=32, group_n=8, dataset_name=afm_train)
[36m(TaskRunner pid=1910234)[0m Step 256 workers (env_num=32, group_n=8, dataset_name=afm_train)
[36m(TaskRunner pid=1910234)[0m Step 256 workers (env_num=32, group_n=8, dataset_name=afm_train)
[36m(TaskRunner pid=1910234)[0m Step 256 workers (env_num=32, group_n=8, dataset_name=afm_train)
[36m(TaskRunner pid=1910234)[0m Step 256 workers (env_num=32, group_n=8, dataset_name=afm_train)
[36m(TaskRunner pid=1910234)[0m Step 256 workers (env_num=32, group_n=8, dataset_name=afm_train)
[36m(TaskRunner pid=1910234)[0m Step 256 workers (env_num=32, group_n=8, dataset_name=afm_train)
[36m(TaskRunner pid=1910234)[0m Training Progress:  84%|████████▁ | 42/50 [9:53:17<6:36:50, 2976.27s/it]Reset 256 workers (env_num=32, group_n=8, dataset_name=afm_train)
[36m(TaskRunner pid=1910234)[0m Step 256 workers (env_num=32, group_n=8, dataset_name=afm_train)
[36m(TaskRunner pid=1910234)[0m Step 256 workers (env_num=32, group_n=8, dataset_name=afm_train)
[36m(TaskRunner pid=1910234)[0m Step 256 workers (env_num=32, group_n=8, dataset_name=afm_train)
[36m(TaskRunner pid=1910234)[0m Step 256 workers (env_num=32, group_n=8, dataset_name=afm_train)
[36m(TaskRunner pid=1910234)[0m Step 256 workers (env_num=32, group_n=8, dataset_name=afm_train)
[36m(TaskRunner pid=1910234)[0m Step 256 workers (env_num=32, group_n=8, dataset_name=afm_train)
[36m(TaskRunner pid=1910234)[0m Step 256 workers (env_num=32, group_n=8, dataset_name=afm_train)
[36m(TaskRunner pid=1910234)[0m Step 256 workers (env_num=32, group_n=8, dataset_name=afm_train)
[36m(TaskRunner pid=1910234)[0m Training Progress:  86%|████████▌ | 43/50 [10:42:04<5:45:30, 2961.52s/it]Reset 256 workers (env_num=32, group_n=8, dataset_name=afm_train)
[36m(TaskRunner pid=1910234)[0m Step 256 workers (env_num=32, group_n=8, dataset_name=afm_train)
[36m(TaskRunner pid=1910234)[0m Step 256 workers (env_num=32, group_n=8, dataset_name=afm_train)
[36m(TaskRunner pid=1910234)[0m Step 256 workers (env_num=32, group_n=8, dataset_name=afm_train)
[36m(TaskRunner pid=1910234)[0m Step 256 workers (env_num=32, group_n=8, dataset_name=afm_train)
[36m(TaskRunner pid=1910234)[0m Step 256 workers (env_num=32, group_n=8, dataset_name=afm_train)
[36m(TaskRunner pid=1910234)[0m Step 256 workers (env_num=32, group_n=8, dataset_name=afm_train)
[36m(TaskRunner pid=1910234)[0m Step 256 workers (env_num=32, group_n=8, dataset_name=afm_train)
[36m(TaskRunner pid=1910234)[0m Step 256 workers (env_num=32, group_n=8, dataset_name=afm_train)
[36m(TaskRunner pid=1910234)[0m Training Progress:  88%|████████▊ | 44/50 [11:32:58<4:58:55, 2989.32s/it]
[36m(TaskRunner pid=1910234)[0m Reset 256 workers (env_num=32, group_n=8, dataset_name=afm_train)
[36m(TaskRunner pid=1910234)[0m Step 256 workers (env_num=32, group_n=8, dataset_name=afm_train)
[36m(TaskRunner pid=1910234)[0m Step 256 workers (env_num=32, group_n=8, dataset_name=afm_train)
[36m(TaskRunner pid=1910234)[0m Step 256 workers (env_num=32, group_n=8, dataset_name=afm_train)
[36m(TaskRunner pid=1910234)[0m Step 256 workers (env_num=32, group_n=8, dataset_name=afm_train)
[36m(TaskRunner pid=1910234)[0m Step 256 workers (env_num=32, group_n=8, dataset_name=afm_train)
[36m(TaskRunner pid=1910234)[0m Step 256 workers (env_num=32, group_n=8, dataset_name=afm_train)
[36m(TaskRunner pid=1910234)[0m Step 256 workers (env_num=32, group_n=8, dataset_name=afm_train)
[36m(TaskRunner pid=1910234)[0m Step 256 workers (env_num=32, group_n=8, dataset_name=afm_train)
[36m(TaskRunner pid=1910234)[0m Training Progress:  90%|█████████ | 45/50 [12:27:13<4:15:47, 3069.42s/it]Reset 256 workers (env_num=32, group_n=8, dataset_name=afm_train)
[36m(TaskRunner pid=1910234)[0m Step 256 workers (env_num=32, group_n=8, dataset_name=afm_train)
[36m(TaskRunner pid=1910234)[0m Step 256 workers (env_num=32, group_n=8, dataset_name=afm_train)
[36m(TaskRunner pid=1910234)[0m Step 256 workers (env_num=32, group_n=8, dataset_name=afm_train)
[36m(TaskRunner pid=1910234)[0m Step 256 workers (env_num=32, group_n=8, dataset_name=afm_train)
[36m(TaskRunner pid=1910234)[0m Step 256 workers (env_num=32, group_n=8, dataset_name=afm_train)
[36m(TaskRunner pid=1910234)[0m Step 256 workers (env_num=32, group_n=8, dataset_name=afm_train)
[36m(TaskRunner pid=1910234)[0m Step 256 workers (env_num=32, group_n=8, dataset_name=afm_train)
[36m(TaskRunner pid=1910234)[0m Step 256 workers (env_num=32, group_n=8, dataset_name=afm_train)
[36m(TaskRunner pid=1910234)[0m Training Progress:  92%|█████████▁| 46/50 [13:18:48<3:25:08, 3077.15s/it]Reset 256 workers (env_num=32, group_n=8, dataset_name=afm_train)
[36m(TaskRunner pid=1910234)[0m Step 256 workers (env_num=32, group_n=8, dataset_name=afm_train)
[36m(TaskRunner pid=1910234)[0m Step 256 workers (env_num=32, group_n=8, dataset_name=afm_train)
[36m(TaskRunner pid=1910234)[0m Step 256 workers (env_num=32, group_n=8, dataset_name=afm_train)
[36m(TaskRunner pid=1910234)[0m Step 256 workers (env_num=32, group_n=8, dataset_name=afm_train)
[36m(TaskRunner pid=1910234)[0m Step 256 workers (env_num=32, group_n=8, dataset_name=afm_train)
[36m(TaskRunner pid=1910234)[0m Step 256 workers (env_num=32, group_n=8, dataset_name=afm_train)
[36m(TaskRunner pid=1910234)[0m Step 256 workers (env_num=32, group_n=8, dataset_name=afm_train)
[36m(TaskRunner pid=1910234)[0m Step 256 workers (env_num=32, group_n=8, dataset_name=afm_train)
[36m(TaskRunner pid=1910234)[0m Training Progress:  94%|█████████▁| 47/50 [13:59:00<2:23:51, 2877.25s/it]
[36m(TaskRunner pid=1910234)[0m Reset 256 workers (env_num=32, group_n=8, dataset_name=afm_train)
[36m(TaskRunner pid=1910234)[0m Step 256 workers (env_num=32, group_n=8, dataset_name=afm_train)
[36m(TaskRunner pid=1910234)[0m Step 256 workers (env_num=32, group_n=8, dataset_name=afm_train)
[36m(TaskRunner pid=1910234)[0m Step 256 workers (env_num=32, group_n=8, dataset_name=afm_train)
[36m(TaskRunner pid=1910234)[0m Step 256 workers (env_num=32, group_n=8, dataset_name=afm_train)
[36m(TaskRunner pid=1910234)[0m Step 256 workers (env_num=32, group_n=8, dataset_name=afm_train)
[36m(TaskRunner pid=1910234)[0m Step 256 workers (env_num=32, group_n=8, dataset_name=afm_train)
[36m(TaskRunner pid=1910234)[0m Step 256 workers (env_num=32, group_n=8, dataset_name=afm_train)
[36m(TaskRunner pid=1910234)[0m Step 256 workers (env_num=32, group_n=8, dataset_name=afm_train)
[36m(TaskRunner pid=1910234)[0m Training Progress:  96%|█████████▌| 48/50 [14:46:15<1:35:28, 2864.34s/it]Reset 256 workers (env_num=32, group_n=8, dataset_name=afm_train)
[36m(TaskRunner pid=1910234)[0m Step 256 workers (env_num=32, group_n=8, dataset_name=afm_train)
[36m(TaskRunner pid=1910234)[0m Step 256 workers (env_num=32, group_n=8, dataset_name=afm_train)
[36m(TaskRunner pid=1910234)[0m Step 256 workers (env_num=32, group_n=8, dataset_name=afm_train)
[36m(TaskRunner pid=1910234)[0m Step 256 workers (env_num=32, group_n=8, dataset_name=afm_train)
[36m(TaskRunner pid=1910234)[0m Step 256 workers (env_num=32, group_n=8, dataset_name=afm_train)
[36m(TaskRunner pid=1910234)[0m Step 256 workers (env_num=32, group_n=8, dataset_name=afm_train)
[36m(TaskRunner pid=1910234)[0m Step 256 workers (env_num=32, group_n=8, dataset_name=afm_train)
[36m(TaskRunner pid=1910234)[0m Step 256 workers (env_num=32, group_n=8, dataset_name=afm_train)
[36m(TaskRunner pid=1910234)[0m Training Progress:  98%|█████████▊| 49/50 [15:18:16<43:01, 2581.18s/it]  
[36m(TaskRunner pid=1910234)[0m Reset 256 workers (env_num=32, group_n=8, dataset_name=afm_train)
[36m(TaskRunner pid=1910234)[0m Step 256 workers (env_num=32, group_n=8, dataset_name=afm_train)
[36m(TaskRunner pid=1910234)[0m Step 256 workers (env_num=32, group_n=8, dataset_name=afm_train)
[36m(TaskRunner pid=1910234)[0m Step 256 workers (env_num=32, group_n=8, dataset_name=afm_train)
[36m(TaskRunner pid=1910234)[0m Step 256 workers (env_num=32, group_n=8, dataset_name=afm_train)
[36m(TaskRunner pid=1910234)[0m Step 256 workers (env_num=32, group_n=8, dataset_name=afm_train)
[36m(TaskRunner pid=1910234)[0m Step 256 workers (env_num=32, group_n=8, dataset_name=afm_train)
[36m(TaskRunner pid=1910234)[0m Step 256 workers (env_num=32, group_n=8, dataset_name=afm_train)
[36m(TaskRunner pid=1910234)[0m Step 256 workers (env_num=32, group_n=8, dataset_name=afm_train)
[36m(TaskRunner pid=1910234)[0m Reset 16 workers (env_num=16, group_n=1, dataset_name=afm_val)
[36m(TaskRunner pid=1910234)[0m Step 16 workers (env_num=16, group_n=1, dataset_name=afm_val)
[36m(TaskRunner pid=1910234)[0m Step 16 workers (env_num=16, group_n=1, dataset_name=afm_val)
[36m(TaskRunner pid=1910234)[0m Step 16 workers (env_num=16, group_n=1, dataset_name=afm_val)
[36m(TaskRunner pid=1910234)[0m Step 16 workers (env_num=16, group_n=1, dataset_name=afm_val)
[36m(TaskRunner pid=1910234)[0m Step 16 workers (env_num=16, group_n=1, dataset_name=afm_val)
[36m(TaskRunner pid=1910234)[0m Step 16 workers (env_num=16, group_n=1, dataset_name=afm_val)
[36m(TaskRunner pid=1910234)[0m Step 16 workers (env_num=16, group_n=1, dataset_name=afm_val)
[36m(TaskRunner pid=1910234)[0m Step 16 workers (env_num=16, group_n=1, dataset_name=afm_val)
[36m(TaskRunner pid=1910234)[0m Reset 16 workers (env_num=16, group_n=1, dataset_name=afm_val)
[36m(TaskRunner pid=1910234)[0m Step 16 workers (env_num=16, group_n=1, dataset_name=afm_val)
[36m(TaskRunner pid=1910234)[0m Step 16 workers (env_num=16, group_n=1, dataset_name=afm_val)
[36m(TaskRunner pid=1910234)[0m Step 16 workers (env_num=16, group_n=1, dataset_name=afm_val)
[36m(TaskRunner pid=1910234)[0m Step 16 workers (env_num=16, group_n=1, dataset_name=afm_val)
[36m(TaskRunner pid=1910234)[0m Step 16 workers (env_num=16, group_n=1, dataset_name=afm_val)
[36m(TaskRunner pid=1910234)[0m Step 16 workers (env_num=16, group_n=1, dataset_name=afm_val)
[36m(TaskRunner pid=1910234)[0m Step 16 workers (env_num=16, group_n=1, dataset_name=afm_val)
[36m(TaskRunner pid=1910234)[0m Step 16 workers (env_num=16, group_n=1, dataset_name=afm_val)
[36m(TaskRunner pid=1910234)[0m Reset 16 workers (env_num=16, group_n=1, dataset_name=afm_val)
[36m(TaskRunner pid=1910234)[0m Step 16 workers (env_num=16, group_n=1, dataset_name=afm_val)
[36m(TaskRunner pid=1910234)[0m Step 16 workers (env_num=16, group_n=1, dataset_name=afm_val)
[36m(TaskRunner pid=1910234)[0m Step 16 workers (env_num=16, group_n=1, dataset_name=afm_val)
[36m(TaskRunner pid=1910234)[0m Step 16 workers (env_num=16, group_n=1, dataset_name=afm_val)
[36m(TaskRunner pid=1910234)[0m Step 16 workers (env_num=16, group_n=1, dataset_name=afm_val)
[36m(TaskRunner pid=1910234)[0m Step 16 workers (env_num=16, group_n=1, dataset_name=afm_val)
[36m(TaskRunner pid=1910234)[0m Step 16 workers (env_num=16, group_n=1, dataset_name=afm_val)
[36m(TaskRunner pid=1910234)[0m Step 16 workers (env_num=16, group_n=1, dataset_name=afm_val)
[36m(TaskRunner pid=1910234)[0m Reset 16 workers (env_num=16, group_n=1, dataset_name=afm_val)
[36m(TaskRunner pid=1910234)[0m Step 16 workers (env_num=16, group_n=1, dataset_name=afm_val)
[36m(TaskRunner pid=1910234)[0m Step 16 workers (env_num=16, group_n=1, dataset_name=afm_val)
[36m(TaskRunner pid=1910234)[0m Step 16 workers (env_num=16, group_n=1, dataset_name=afm_val)
[36m(TaskRunner pid=1910234)[0m Step 16 workers (env_num=16, group_n=1, dataset_name=afm_val)
[36m(TaskRunner pid=1910234)[0m Step 16 workers (env_num=16, group_n=1, dataset_name=afm_val)
[36m(TaskRunner pid=1910234)[0m Step 16 workers (env_num=16, group_n=1, dataset_name=afm_val)
[36m(TaskRunner pid=1910234)[0m Step 16 workers (env_num=16, group_n=1, dataset_name=afm_val)
[36m(TaskRunner pid=1910234)[0m Step 16 workers (env_num=16, group_n=1, dataset_name=afm_val)
[36m(TaskRunner pid=1910234)[0m Reset 16 workers (env_num=16, group_n=1, dataset_name=afm_val)
[36m(TaskRunner pid=1910234)[0m Step 16 workers (env_num=16, group_n=1, dataset_name=afm_val)
[36m(TaskRunner pid=1910234)[0m Step 16 workers (env_num=16, group_n=1, dataset_name=afm_val)
[36m(TaskRunner pid=1910234)[0m Step 16 workers (env_num=16, group_n=1, dataset_name=afm_val)
[36m(TaskRunner pid=1910234)[0m Step 16 workers (env_num=16, group_n=1, dataset_name=afm_val)
[36m(TaskRunner pid=1910234)[0m Step 16 workers (env_num=16, group_n=1, dataset_name=afm_val)
[36m(TaskRunner pid=1910234)[0m Reset 16 workers (env_num=16, group_n=1, dataset_name=afm_val)
[36m(TaskRunner pid=1910234)[0m Step 16 workers (env_num=16, group_n=1, dataset_name=afm_val)
[36m(TaskRunner pid=1910234)[0m Step 16 workers (env_num=16, group_n=1, dataset_name=afm_val)
[36m(TaskRunner pid=1910234)[0m Step 16 workers (env_num=16, group_n=1, dataset_name=afm_val)
[36m(TaskRunner pid=1910234)[0m Step 16 workers (env_num=16, group_n=1, dataset_name=afm_val)
[36m(TaskRunner pid=1910234)[0m Reset 16 workers (env_num=16, group_n=1, dataset_name=afm_val)
[36m(TaskRunner pid=1910234)[0m Step 16 workers (env_num=16, group_n=1, dataset_name=afm_val)
[36m(TaskRunner pid=1910234)[0m Step 16 workers (env_num=16, group_n=1, dataset_name=afm_val)
[36m(TaskRunner pid=1910234)[0m Step 16 workers (env_num=16, group_n=1, dataset_name=afm_val)
[36m(TaskRunner pid=1910234)[0m Step 16 workers (env_num=16, group_n=1, dataset_name=afm_val)
[36m(TaskRunner pid=1910234)[0m Step 16 workers (env_num=16, group_n=1, dataset_name=afm_val)
[36m(TaskRunner pid=1910234)[0m Step 16 workers (env_num=16, group_n=1, dataset_name=afm_val)
[36m(TaskRunner pid=1910234)[0m Step 16 workers (env_num=16, group_n=1, dataset_name=afm_val)
[36m(TaskRunner pid=1910234)[0m Step 16 workers (env_num=16, group_n=1, dataset_name=afm_val)
[36m(TaskRunner pid=1910234)[0m Reset 16 workers (env_num=16, group_n=1, dataset_name=afm_val)
[36m(TaskRunner pid=1910234)[0m Step 16 workers (env_num=16, group_n=1, dataset_name=afm_val)
[36m(TaskRunner pid=1910234)[0m Step 16 workers (env_num=16, group_n=1, dataset_name=afm_val)
[36m(TaskRunner pid=1910234)[0m Step 16 workers (env_num=16, group_n=1, dataset_name=afm_val)
[36m(TaskRunner pid=1910234)[0m Step 16 workers (env_num=16, group_n=1, dataset_name=afm_val)
[36m(TaskRunner pid=1910234)[0m Step 16 workers (env_num=16, group_n=1, dataset_name=afm_val)
[36m(TaskRunner pid=1910234)[0m Reset 16 workers (env_num=16, group_n=1, dataset_name=afm_val)
[36m(TaskRunner pid=1910234)[0m Step 16 workers (env_num=16, group_n=1, dataset_name=afm_val)
[36m(TaskRunner pid=1910234)[0m Step 16 workers (env_num=16, group_n=1, dataset_name=afm_val)
[36m(TaskRunner pid=1910234)[0m Step 16 workers (env_num=16, group_n=1, dataset_name=afm_val)
[36m(TaskRunner pid=1910234)[0m Step 16 workers (env_num=16, group_n=1, dataset_name=afm_val)
[36m(TaskRunner pid=1910234)[0m Step 16 workers (env_num=16, group_n=1, dataset_name=afm_val)
[36m(TaskRunner pid=1910234)[0m Step 16 workers (env_num=16, group_n=1, dataset_name=afm_val)
[36m(TaskRunner pid=1910234)[0m Step 16 workers (env_num=16, group_n=1, dataset_name=afm_val)
[36m(TaskRunner pid=1910234)[0m Step 16 workers (env_num=16, group_n=1, dataset_name=afm_val)
[36m(TaskRunner pid=1910234)[0m Reset 16 workers (env_num=16, group_n=1, dataset_name=afm_val)
[36m(TaskRunner pid=1910234)[0m Step 16 workers (env_num=16, group_n=1, dataset_name=afm_val)
[36m(TaskRunner pid=1910234)[0m Step 16 workers (env_num=16, group_n=1, dataset_name=afm_val)
[36m(TaskRunner pid=1910234)[0m Step 16 workers (env_num=16, group_n=1, dataset_name=afm_val)
[36m(TaskRunner pid=1910234)[0m Step 16 workers (env_num=16, group_n=1, dataset_name=afm_val)
[36m(TaskRunner pid=1910234)[0m Step 16 workers (env_num=16, group_n=1, dataset_name=afm_val)
[36m(TaskRunner pid=1910234)[0m Step 16 workers (env_num=16, group_n=1, dataset_name=afm_val)
[36m(TaskRunner pid=1910234)[0m Step 16 workers (env_num=16, group_n=1, dataset_name=afm_val)
[36m(TaskRunner pid=1910234)[0m Step 16 workers (env_num=16, group_n=1, dataset_name=afm_val)
[36m(TaskRunner pid=1910234)[0m Reset 16 workers (env_num=16, group_n=1, dataset_name=afm_val)
[36m(TaskRunner pid=1910234)[0m Step 16 workers (env_num=16, group_n=1, dataset_name=afm_val)
[36m(TaskRunner pid=1910234)[0m Step 16 workers (env_num=16, group_n=1, dataset_name=afm_val)
[36m(TaskRunner pid=1910234)[0m Step 16 workers (env_num=16, group_n=1, dataset_name=afm_val)
[36m(TaskRunner pid=1910234)[0m Step 16 workers (env_num=16, group_n=1, dataset_name=afm_val)
[36m(TaskRunner pid=1910234)[0m Step 16 workers (env_num=16, group_n=1, dataset_name=afm_val)
[36m(TaskRunner pid=1910234)[0m Step 16 workers (env_num=16, group_n=1, dataset_name=afm_val)
[36m(TaskRunner pid=1910234)[0m Step 16 workers (env_num=16, group_n=1, dataset_name=afm_val)
[36m(TaskRunner pid=1910234)[0m Reset 16 workers (env_num=16, group_n=1, dataset_name=afm_val)
[36m(TaskRunner pid=1910234)[0m Step 16 workers (env_num=16, group_n=1, dataset_name=afm_val)
[36m(TaskRunner pid=1910234)[0m Step 16 workers (env_num=16, group_n=1, dataset_name=afm_val)
[36m(TaskRunner pid=1910234)[0m Step 16 workers (env_num=16, group_n=1, dataset_name=afm_val)
[36m(TaskRunner pid=1910234)[0m Step 16 workers (env_num=16, group_n=1, dataset_name=afm_val)
[36m(TaskRunner pid=1910234)[0m Step 16 workers (env_num=16, group_n=1, dataset_name=afm_val)
[36m(TaskRunner pid=1910234)[0m Step 16 workers (env_num=16, group_n=1, dataset_name=afm_val)
[36m(TaskRunner pid=1910234)[0m Step 16 workers (env_num=16, group_n=1, dataset_name=afm_val)
[36m(TaskRunner pid=1910234)[0m Reset 16 workers (env_num=16, group_n=1, dataset_name=afm_val)
[36m(TaskRunner pid=1910234)[0m Step 16 workers (env_num=16, group_n=1, dataset_name=afm_val)
[36m(TaskRunner pid=1910234)[0m Step 16 workers (env_num=16, group_n=1, dataset_name=afm_val)
[36m(TaskRunner pid=1910234)[0m Step 16 workers (env_num=16, group_n=1, dataset_name=afm_val)
[36m(TaskRunner pid=1910234)[0m Step 16 workers (env_num=16, group_n=1, dataset_name=afm_val)
[36m(TaskRunner pid=1910234)[0m Step 16 workers (env_num=16, group_n=1, dataset_name=afm_val)
[36m(TaskRunner pid=1910234)[0m Step 16 workers (env_num=16, group_n=1, dataset_name=afm_val)
[36m(TaskRunner pid=1910234)[0m Reset 16 workers (env_num=16, group_n=1, dataset_name=afm_val)
[36m(TaskRunner pid=1910234)[0m Step 16 workers (env_num=16, group_n=1, dataset_name=afm_val)
[36m(TaskRunner pid=1910234)[0m Step 16 workers (env_num=16, group_n=1, dataset_name=afm_val)
[36m(TaskRunner pid=1910234)[0m Step 16 workers (env_num=16, group_n=1, dataset_name=afm_val)
[36m(TaskRunner pid=1910234)[0m Step 16 workers (env_num=16, group_n=1, dataset_name=afm_val)
[36m(TaskRunner pid=1910234)[0m Step 16 workers (env_num=16, group_n=1, dataset_name=afm_val)
[36m(TaskRunner pid=1910234)[0m Step 16 workers (env_num=16, group_n=1, dataset_name=afm_val)
[36m(TaskRunner pid=1910234)[0m Step 16 workers (env_num=16, group_n=1, dataset_name=afm_val)
[36m(TaskRunner pid=1910234)[0m Step 16 workers (env_num=16, group_n=1, dataset_name=afm_val)
[36m(TaskRunner pid=1910234)[0m Reset 16 workers (env_num=16, group_n=1, dataset_name=afm_val)
[36m(TaskRunner pid=1910234)[0m Step 16 workers (env_num=16, group_n=1, dataset_name=afm_val)
[36m(TaskRunner pid=1910234)[0m Step 16 workers (env_num=16, group_n=1, dataset_name=afm_val)
[36m(TaskRunner pid=1910234)[0m Step 16 workers (env_num=16, group_n=1, dataset_name=afm_val)
[36m(TaskRunner pid=1910234)[0m Step 16 workers (env_num=16, group_n=1, dataset_name=afm_val)
[36m(TaskRunner pid=1910234)[0m Step 16 workers (env_num=16, group_n=1, dataset_name=afm_val)
[36m(TaskRunner pid=1910234)[0m Step 16 workers (env_num=16, group_n=1, dataset_name=afm_val)
[36m(TaskRunner pid=1910234)[0m Reset 16 workers (env_num=16, group_n=1, dataset_name=afm_val)
[36m(TaskRunner pid=1910234)[0m Step 16 workers (env_num=16, group_n=1, dataset_name=afm_val)
[36m(TaskRunner pid=1910234)[0m Step 16 workers (env_num=16, group_n=1, dataset_name=afm_val)
[36m(TaskRunner pid=1910234)[0m Step 16 workers (env_num=16, group_n=1, dataset_name=afm_val)
[36m(TaskRunner pid=1910234)[0m Step 16 workers (env_num=16, group_n=1, dataset_name=afm_val)
[36m(TaskRunner pid=1910234)[0m Step 16 workers (env_num=16, group_n=1, dataset_name=afm_val)
[36m(TaskRunner pid=1910234)[0m Step 16 workers (env_num=16, group_n=1, dataset_name=afm_val)
[36m(TaskRunner pid=1910234)[0m Reset 16 workers (env_num=16, group_n=1, dataset_name=afm_val)
[36m(TaskRunner pid=1910234)[0m Step 16 workers (env_num=16, group_n=1, dataset_name=afm_val)
[36m(TaskRunner pid=1910234)[0m Step 16 workers (env_num=16, group_n=1, dataset_name=afm_val)
[36m(TaskRunner pid=1910234)[0m Step 16 workers (env_num=16, group_n=1, dataset_name=afm_val)
[36m(TaskRunner pid=1910234)[0m Step 16 workers (env_num=16, group_n=1, dataset_name=afm_val)
[36m(TaskRunner pid=1910234)[0m Step 16 workers (env_num=16, group_n=1, dataset_name=afm_val)
[36m(TaskRunner pid=1910234)[0m Step 16 workers (env_num=16, group_n=1, dataset_name=afm_val)
[36m(TaskRunner pid=1910234)[0m Reset 16 workers (env_num=16, group_n=1, dataset_name=afm_val)
[36m(TaskRunner pid=1910234)[0m Step 16 workers (env_num=16, group_n=1, dataset_name=afm_val)
[36m(TaskRunner pid=1910234)[0m Step 16 workers (env_num=16, group_n=1, dataset_name=afm_val)
[36m(TaskRunner pid=1910234)[0m Step 16 workers (env_num=16, group_n=1, dataset_name=afm_val)
[36m(TaskRunner pid=1910234)[0m Step 16 workers (env_num=16, group_n=1, dataset_name=afm_val)
[36m(TaskRunner pid=1910234)[0m Step 16 workers (env_num=16, group_n=1, dataset_name=afm_val)
[36m(TaskRunner pid=1910234)[0m Step 16 workers (env_num=16, group_n=1, dataset_name=afm_val)
[36m(TaskRunner pid=1910234)[0m Step 16 workers (env_num=16, group_n=1, dataset_name=afm_val)
[36m(TaskRunner pid=1910234)[0m Step 16 workers (env_num=16, group_n=1, dataset_name=afm_val)
[36m(TaskRunner pid=1910234)[0m Reset 16 workers (env_num=16, group_n=1, dataset_name=afm_val)
[36m(TaskRunner pid=1910234)[0m Step 16 workers (env_num=16, group_n=1, dataset_name=afm_val)
[36m(TaskRunner pid=1910234)[0m Step 16 workers (env_num=16, group_n=1, dataset_name=afm_val)
[36m(TaskRunner pid=1910234)[0m Step 16 workers (env_num=16, group_n=1, dataset_name=afm_val)
[36m(TaskRunner pid=1910234)[0m Step 16 workers (env_num=16, group_n=1, dataset_name=afm_val)
[36m(TaskRunner pid=1910234)[0m Step 16 workers (env_num=16, group_n=1, dataset_name=afm_val)
[36m(TaskRunner pid=1910234)[0m Step 16 workers (env_num=16, group_n=1, dataset_name=afm_val)
[36m(TaskRunner pid=1910234)[0m Step 16 workers (env_num=16, group_n=1, dataset_name=afm_val)
[36m(TaskRunner pid=1910234)[0m Step 16 workers (env_num=16, group_n=1, dataset_name=afm_val)
[36m(TaskRunner pid=1910234)[0m Reset 16 workers (env_num=16, group_n=1, dataset_name=afm_val)
[36m(TaskRunner pid=1910234)[0m Step 16 workers (env_num=16, group_n=1, dataset_name=afm_val)
[36m(TaskRunner pid=1910234)[0m Step 16 workers (env_num=16, group_n=1, dataset_name=afm_val)
[36m(TaskRunner pid=1910234)[0m Step 16 workers (env_num=16, group_n=1, dataset_name=afm_val)
[36m(TaskRunner pid=1910234)[0m Step 16 workers (env_num=16, group_n=1, dataset_name=afm_val)
[36m(TaskRunner pid=1910234)[0m Step 16 workers (env_num=16, group_n=1, dataset_name=afm_val)
[36m(TaskRunner pid=1910234)[0m Reset 16 workers (env_num=16, group_n=1, dataset_name=afm_val)
[36m(TaskRunner pid=1910234)[0m Step 16 workers (env_num=16, group_n=1, dataset_name=afm_val)
[36m(TaskRunner pid=1910234)[0m Step 16 workers (env_num=16, group_n=1, dataset_name=afm_val)
[36m(TaskRunner pid=1910234)[0m Step 16 workers (env_num=16, group_n=1, dataset_name=afm_val)
[36m(TaskRunner pid=1910234)[0m Step 16 workers (env_num=16, group_n=1, dataset_name=afm_val)
[36m(TaskRunner pid=1910234)[0m Step 16 workers (env_num=16, group_n=1, dataset_name=afm_val)
[36m(TaskRunner pid=1910234)[0m Step 16 workers (env_num=16, group_n=1, dataset_name=afm_val)
[36m(TaskRunner pid=1910234)[0m Step 16 workers (env_num=16, group_n=1, dataset_name=afm_val)
[36m(TaskRunner pid=1910234)[0m Step 16 workers (env_num=16, group_n=1, dataset_name=afm_val)
[36m(TaskRunner pid=1910234)[0m Reset 16 workers (env_num=16, group_n=1, dataset_name=afm_val)
[36m(TaskRunner pid=1910234)[0m Step 16 workers (env_num=16, group_n=1, dataset_name=afm_val)
[36m(TaskRunner pid=1910234)[0m Step 16 workers (env_num=16, group_n=1, dataset_name=afm_val)
[36m(TaskRunner pid=1910234)[0m Step 16 workers (env_num=16, group_n=1, dataset_name=afm_val)
[36m(TaskRunner pid=1910234)[0m Step 16 workers (env_num=16, group_n=1, dataset_name=afm_val)
[36m(TaskRunner pid=1910234)[0m Step 16 workers (env_num=16, group_n=1, dataset_name=afm_val)
[36m(TaskRunner pid=1910234)[0m Reset 16 workers (env_num=16, group_n=1, dataset_name=afm_val)
[36m(TaskRunner pid=1910234)[0m Step 16 workers (env_num=16, group_n=1, dataset_name=afm_val)
[36m(TaskRunner pid=1910234)[0m Step 16 workers (env_num=16, group_n=1, dataset_name=afm_val)
[36m(TaskRunner pid=1910234)[0m Step 16 workers (env_num=16, group_n=1, dataset_name=afm_val)
[36m(TaskRunner pid=1910234)[0m Step 16 workers (env_num=16, group_n=1, dataset_name=afm_val)
[36m(TaskRunner pid=1910234)[0m Step 16 workers (env_num=16, group_n=1, dataset_name=afm_val)
[36m(TaskRunner pid=1910234)[0m Step 16 workers (env_num=16, group_n=1, dataset_name=afm_val)
[36m(TaskRunner pid=1910234)[0m Step 16 workers (env_num=16, group_n=1, dataset_name=afm_val)
[36m(TaskRunner pid=1910234)[0m Step 16 workers (env_num=16, group_n=1, dataset_name=afm_val)
[36m(TaskRunner pid=1910234)[0m Reset 16 workers (env_num=16, group_n=1, dataset_name=afm_val)
[36m(TaskRunner pid=1910234)[0m Step 16 workers (env_num=16, group_n=1, dataset_name=afm_val)
[36m(TaskRunner pid=1910234)[0m Step 16 workers (env_num=16, group_n=1, dataset_name=afm_val)
[36m(TaskRunner pid=1910234)[0m Step 16 workers (env_num=16, group_n=1, dataset_name=afm_val)
[36m(TaskRunner pid=1910234)[0m Step 16 workers (env_num=16, group_n=1, dataset_name=afm_val)
[36m(TaskRunner pid=1910234)[0m Reset 16 workers (env_num=16, group_n=1, dataset_name=afm_val)
[36m(TaskRunner pid=1910234)[0m Step 16 workers (env_num=16, group_n=1, dataset_name=afm_val)
[36m(TaskRunner pid=1910234)[0m Step 16 workers (env_num=16, group_n=1, dataset_name=afm_val)
[36m(TaskRunner pid=1910234)[0m Step 16 workers (env_num=16, group_n=1, dataset_name=afm_val)
[36m(TaskRunner pid=1910234)[0m Step 16 workers (env_num=16, group_n=1, dataset_name=afm_val)
[36m(TaskRunner pid=1910234)[0m Step 16 workers (env_num=16, group_n=1, dataset_name=afm_val)
[36m(TaskRunner pid=1910234)[0m Reset 16 workers (env_num=16, group_n=1, dataset_name=afm_val)
[36m(TaskRunner pid=1910234)[0m Step 16 workers (env_num=16, group_n=1, dataset_name=afm_val)
[36m(TaskRunner pid=1910234)[0m Step 16 workers (env_num=16, group_n=1, dataset_name=afm_val)
[36m(TaskRunner pid=1910234)[0m Step 16 workers (env_num=16, group_n=1, dataset_name=afm_val)
[36m(TaskRunner pid=1910234)[0m Step 16 workers (env_num=16, group_n=1, dataset_name=afm_val)
[36m(TaskRunner pid=1910234)[0m Step 16 workers (env_num=16, group_n=1, dataset_name=afm_val)
[36m(TaskRunner pid=1910234)[0m Step 16 workers (env_num=16, group_n=1, dataset_name=afm_val)
[36m(TaskRunner pid=1910234)[0m Step 16 workers (env_num=16, group_n=1, dataset_name=afm_val)
[36m(TaskRunner pid=1910234)[0m Step 16 workers (env_num=16, group_n=1, dataset_name=afm_val)
[36m(TaskRunner pid=1910234)[0m Reset 16 workers (env_num=16, group_n=1, dataset_name=afm_val)
[36m(TaskRunner pid=1910234)[0m Step 16 workers (env_num=16, group_n=1, dataset_name=afm_val)
[36m(TaskRunner pid=1910234)[0m Step 16 workers (env_num=16, group_n=1, dataset_name=afm_val)
[36m(TaskRunner pid=1910234)[0m Step 16 workers (env_num=16, group_n=1, dataset_name=afm_val)
[36m(TaskRunner pid=1910234)[0m Step 16 workers (env_num=16, group_n=1, dataset_name=afm_val)
[36m(TaskRunner pid=1910234)[0m Step 16 workers (env_num=16, group_n=1, dataset_name=afm_val)
[36m(TaskRunner pid=1910234)[0m Step 16 workers (env_num=16, group_n=1, dataset_name=afm_val)
[36m(TaskRunner pid=1910234)[0m Step 16 workers (env_num=16, group_n=1, dataset_name=afm_val)
[36m(TaskRunner pid=1910234)[0m Reset 16 workers (env_num=16, group_n=1, dataset_name=afm_val)
[36m(TaskRunner pid=1910234)[0m Step 16 workers (env_num=16, group_n=1, dataset_name=afm_val)
[36m(TaskRunner pid=1910234)[0m Step 16 workers (env_num=16, group_n=1, dataset_name=afm_val)
[36m(TaskRunner pid=1910234)[0m Step 16 workers (env_num=16, group_n=1, dataset_name=afm_val)
[36m(TaskRunner pid=1910234)[0m Step 16 workers (env_num=16, group_n=1, dataset_name=afm_val)
[36m(TaskRunner pid=1910234)[0m Step 16 workers (env_num=16, group_n=1, dataset_name=afm_val)
[36m(TaskRunner pid=1910234)[0m Step 16 workers (env_num=16, group_n=1, dataset_name=afm_val)
[36m(TaskRunner pid=1910234)[0m Step 16 workers (env_num=16, group_n=1, dataset_name=afm_val)
[36m(TaskRunner pid=1910234)[0m Step 16 workers (env_num=16, group_n=1, dataset_name=afm_val)
[36m(TaskRunner pid=1910234)[0m Reset 16 workers (env_num=16, group_n=1, dataset_name=afm_val)
[36m(TaskRunner pid=1910234)[0m Step 16 workers (env_num=16, group_n=1, dataset_name=afm_val)
[36m(TaskRunner pid=1910234)[0m Step 16 workers (env_num=16, group_n=1, dataset_name=afm_val)
[36m(TaskRunner pid=1910234)[0m Step 16 workers (env_num=16, group_n=1, dataset_name=afm_val)
[36m(TaskRunner pid=1910234)[0m Step 16 workers (env_num=16, group_n=1, dataset_name=afm_val)
[36m(TaskRunner pid=1910234)[0m Reset 16 workers (env_num=16, group_n=1, dataset_name=afm_val)
[36m(TaskRunner pid=1910234)[0m Step 16 workers (env_num=16, group_n=1, dataset_name=afm_val)
[36m(TaskRunner pid=1910234)[0m Step 16 workers (env_num=16, group_n=1, dataset_name=afm_val)
[36m(TaskRunner pid=1910234)[0m Step 16 workers (env_num=16, group_n=1, dataset_name=afm_val)
[36m(TaskRunner pid=1910234)[0m Step 16 workers (env_num=16, group_n=1, dataset_name=afm_val)
[36m(TaskRunner pid=1910234)[0m Step 16 workers (env_num=16, group_n=1, dataset_name=afm_val)
[36m(TaskRunner pid=1910234)[0m Step 16 workers (env_num=16, group_n=1, dataset_name=afm_val)
[36m(TaskRunner pid=1910234)[0m Reset 16 workers (env_num=16, group_n=1, dataset_name=afm_val)
[36m(TaskRunner pid=1910234)[0m Step 16 workers (env_num=16, group_n=1, dataset_name=afm_val)
[36m(TaskRunner pid=1910234)[0m Step 16 workers (env_num=16, group_n=1, dataset_name=afm_val)
[36m(TaskRunner pid=1910234)[0m Step 16 workers (env_num=16, group_n=1, dataset_name=afm_val)
[36m(TaskRunner pid=1910234)[0m Step 16 workers (env_num=16, group_n=1, dataset_name=afm_val)
[36m(TaskRunner pid=1910234)[0m Step 16 workers (env_num=16, group_n=1, dataset_name=afm_val)
[36m(TaskRunner pid=1910234)[0m Step 16 workers (env_num=16, group_n=1, dataset_name=afm_val)
[36m(TaskRunner pid=1910234)[0m Step 16 workers (env_num=16, group_n=1, dataset_name=afm_val)
[36m(TaskRunner pid=1910234)[0m Step 16 workers (env_num=16, group_n=1, dataset_name=afm_val)
[36m(TaskRunner pid=1910234)[0m Reset 16 workers (env_num=16, group_n=1, dataset_name=afm_val)
[36m(TaskRunner pid=1910234)[0m Step 16 workers (env_num=16, group_n=1, dataset_name=afm_val)
[36m(TaskRunner pid=1910234)[0m Step 16 workers (env_num=16, group_n=1, dataset_name=afm_val)
[36m(TaskRunner pid=1910234)[0m Step 16 workers (env_num=16, group_n=1, dataset_name=afm_val)
[36m(TaskRunner pid=1910234)[0m Step 16 workers (env_num=16, group_n=1, dataset_name=afm_val)
[36m(TaskRunner pid=1910234)[0m Step 16 workers (env_num=16, group_n=1, dataset_name=afm_val)
[36m(TaskRunner pid=1910234)[0m Step 16 workers (env_num=16, group_n=1, dataset_name=afm_val)
[36m(TaskRunner pid=1910234)[0m Step 16 workers (env_num=16, group_n=1, dataset_name=afm_val)
[36m(TaskRunner pid=1910234)[0m Step 16 workers (env_num=16, group_n=1, dataset_name=afm_val)
[36m(TaskRunner pid=1910234)[0m wandb: WARNING Tried to log to step 50 that is less than the current step 82. Steps must be monotonically increasing, so this data will be ignored. See https://wandb.me/define-metric to log data out of order.
[36m(TaskRunner pid=1910234)[0m Training Progress: 100%|██████████| 50/50 [18:55:28<00:00, 5718.86s/it]Training Progress: 100%|██████████| 50/50 [18:55:28<00:00, 3406.42s/it]
[36m(TaskRunner pid=1910234)[0m wandb:                                                                                
[36m(TaskRunner pid=1910234)[0m wandb: 
[36m(TaskRunner pid=1910234)[0m wandb: Run history:
[36m(TaskRunner pid=1910234)[0m wandb:      actor/entropy_loss █▇▇▆▆▅▄▄▄▄▂▂▂▁▁▁▁▂▁
[36m(TaskRunner pid=1910234)[0m wandb:         actor/grad_norm ▄▂█▇▄▅▆▁▄█▆▄▃▃▅▇▄▂▅
[36m(TaskRunner pid=1910234)[0m wandb:           actor/kl_coef ▁▁▁▁▁▁▁▁▁▁▁▁▁▁▁▁▁▁▁
[36m(TaskRunner pid=1910234)[0m wandb:           actor/kl_loss ▄▆▄▇▆▆▆▆▆▆▅▃▆▁▅▃▆██
[36m(TaskRunner pid=1910234)[0m wandb:                actor/lr ▁▁▁▁▁▁▁▁▁▁▁▁▁▁▁▁▁▁▁
[36m(TaskRunner pid=1910234)[0m wandb:       actor/pg_clipfrac ▁▂▃▄▄▇▅▅▃▇▆▆▅▆▃▂▇▇█
[36m(TaskRunner pid=1910234)[0m wandb: actor/pg_clipfrac_lower ▁▁▁▁▁▁▁▁▁▁▁▁▁▁▁▁▁▁▁
[36m(TaskRunner pid=1910234)[0m wandb:           actor/pg_loss ▄▅▃▃█▃▁▆▆▁▆▇▄▃▇▄▇█▆
[36m(TaskRunner pid=1910234)[0m wandb:            actor/ppo_kl ▃▅▆▅█▁▄▅▅▃▅▅▂▄█▆▄▁█
[36m(TaskRunner pid=1910234)[0m wandb:     avg_passed_per_step ▁▁▁▁▁▁▁▁▁▁▁▁▁▁▁▁▁▁▁
[36m(TaskRunner pid=1910234)[0m wandb:                     +65 ...
[36m(TaskRunner pid=1910234)[0m wandb: 
[36m(TaskRunner pid=1910234)[0m wandb: Run summary:
[36m(TaskRunner pid=1910234)[0m wandb:      actor/entropy_loss 0.25703
[36m(TaskRunner pid=1910234)[0m wandb:         actor/grad_norm 5.78222
[36m(TaskRunner pid=1910234)[0m wandb:           actor/kl_coef 0.001
[36m(TaskRunner pid=1910234)[0m wandb:           actor/kl_loss 0.20842
[36m(TaskRunner pid=1910234)[0m wandb:                actor/lr 0.0
[36m(TaskRunner pid=1910234)[0m wandb:       actor/pg_clipfrac 0.01734
[36m(TaskRunner pid=1910234)[0m wandb: actor/pg_clipfrac_lower 0
[36m(TaskRunner pid=1910234)[0m wandb:           actor/pg_loss -0.80524
[36m(TaskRunner pid=1910234)[0m wandb:            actor/ppo_kl 0.00146
[36m(TaskRunner pid=1910234)[0m wandb:     avg_passed_per_step 0
[36m(TaskRunner pid=1910234)[0m wandb:                     +65 ...
[36m(TaskRunner pid=1910234)[0m wandb: 
[36m(TaskRunner pid=1910234)[0m wandb: 🚀 View run deepresearch_1.7b_belief_shaped_grpo_fast_reward_resume at: https://wandb.ai/ssmurali-cmu/DeepResearch_RL/runs/yhzt8s7e
[36m(TaskRunner pid=1910234)[0m wandb: ⭐️ View project at: https://wandb.ai/ssmurali-cmu/DeepResearch_RL
[36m(TaskRunner pid=1910234)[0m wandb: Synced 5 W&B file(s), 1 media file(s), 2 artifact file(s) and 0 other file(s)
[36m(TaskRunner pid=1910234)[0m wandb: Find logs at: ./wandb/run-20251222_232250-yhzt8s7e/logs
[36m(TaskRunner pid=1910234)[0m wandb: WARNING Tried to log to step 50 that is less than the current step 82. Steps must be monotonically increasing, so this data will be ignored. See https://wandb.me/define-metric to log data out of order.
